{
  "data": {
    "chain_root_diagnostic_id": "APS-DIAG-B9554C6D5867A1CAF84AABD7",
    "details": {
      "candidate": "000000000"
    },
    "diagnostic_id": "APS-DIAG-B9554C6D5867A1CAF84AABD7",
    "diagnostic_kind": "STATE_ASSESSMENT",
    "disposition": "RECORDED",
    "notes": [
      "The candidate is a well-formed nine-bit realm; no operational context was supplied."
    ],
    "occurrence_metadata": {
      "host": "host-a",
      "process": 42,
      "timestamp": "2026-10-11T00:00:00Z"
    },
    "parent_diagnostic_id": null,
    "rule_ids": [
      "ASH-STATE-001"
    ],
    "schema_version": "1.0",
    "sequence_number": 1,
    "severity": "INFO",
    "stage": "ASSESS",
    "subject_reference": "APS-OCCURRENCE-SUBJECT",
    "summary": "Structural state observed"
  },
  "id": "APS-DIAG-B9554C6D5867A1CAF84AABD7",
  "product_version": "1.0.0-rc.2",
  "schema_version": "1.0"
}
